{
  "id": "EQ-MS-TA9012",
  "title": "Backdoor container",
  "description": "Attackers run their malicious code in a container in the cluster. By using the Kubernetes controllers such as DaemonSets or Deployments, attackers can ensure that a constant number of containers run in one, or all, the nodes in the cluster.",
  "tags": [
    "kubernetes",
    "stub"
  ],
  "mitre_attack": {
    "technique_id": "T1543",
    "name": "Create or Modify System Process",
    "tactics": [
      "persistence",
      "privilege_escalation"
    ],
    "sub_technique_of": null,
    "platforms": [
      "Containers"
    ],
    "url": "https://attack.mitre.org/techniques/T1543/"
  },
  "microsoft_k8s_matrix": {
    "id": "MS-TA9012",
    "name": "Backdoor container",
    "tactic": "persistence",
    "url": "https://microsoft.github.io/Threat-Matrix-for-Kubernetes/techniques/Backdoor%20container/",
    "description": "Attackers run their malicious code in a container in the cluster. By using the Kubernetes controllers such as DaemonSets or Deployments, attackers can ensure that a constant number of containers run in one, or all, the nodes in the cluster."
  },
  "data_components": [],
  "detection_strategies": [],
  "vendor_detections": [],
  "references": [
    "https://microsoft.github.io/Threat-Matrix-for-Kubernetes/techniques/Backdoor%20container/",
    "https://attack.mitre.org/techniques/T1543/"
  ],
  "metadata": {
    "version": "0.1.0",
    "schema_version": "0.1.0",
    "created": "2026-05-04",
    "updated": "2026-05-04",
    "contributors": [
      "equilibrium-bootstrap"
    ]
  }
}
