{
  "id": "EQ-MS-TA9022",
  "title": "Delete K8S events",
  "description": "A Kubernetes event is a Kubernetes object that logs state changes and failures of the resources in the cluster. Example events are a container creation, an image pull, or a pod scheduling on a node.  Kubernetes events can be very useful for identifying changes that occur in the cluster. Therefore, attackers may want to delete these events (e.g., by using: \u201ckubectl delete events\u2013all\u201d) in an attempt to avoid detection of their activity in the cluster.",
  "tags": [
    "kubernetes",
    "stub"
  ],
  "mitre_attack": {
    "technique_id": "T1070",
    "name": "Indicator Removal",
    "tactics": [
      "defense_evasion"
    ],
    "sub_technique_of": null,
    "platforms": [
      "Containers"
    ],
    "url": "https://attack.mitre.org/techniques/T1070/"
  },
  "microsoft_k8s_matrix": {
    "id": "MS-TA9022",
    "name": "Delete K8S events",
    "tactic": "defense_evasion",
    "url": "https://microsoft.github.io/Threat-Matrix-for-Kubernetes/techniques/Delete%20K8S%20events/",
    "description": "A Kubernetes event is a Kubernetes object that logs state changes and failures of the resources in the cluster. Example events are a container creation, an image pull, or a pod scheduling on a node.  Kubernetes events can be very useful for identifying changes that occur in the cluster. Therefore, attackers may want to delete these events (e.g., by using: \u201ckubectl delete events\u2013all\u201d) in an attempt to avoid detection of their activity in the cluster."
  },
  "data_components": [],
  "detection_strategies": [],
  "vendor_detections": [],
  "references": [
    "https://microsoft.github.io/Threat-Matrix-for-Kubernetes/techniques/Delete%20K8S%20events/",
    "https://attack.mitre.org/techniques/T1070/"
  ],
  "metadata": {
    "version": "0.1.0",
    "schema_version": "0.1.0",
    "created": "2026-05-04",
    "updated": "2026-05-04",
    "contributors": [
      "equilibrium-bootstrap"
    ]
  }
}
