{
  "id": "EQ-MS-TA9031",
  "title": "Network mapping",
  "description": "Attackers may try to map the cluster network to get information on the running applications, including scanning for known vulnerabilities. By default, there is no restriction on pods communication in Kubernetes. Therefore, attackers who gain access to a single container, may use it to probe the network.",
  "tags": [
    "kubernetes",
    "stub"
  ],
  "mitre_attack": {
    "technique_id": "T1046",
    "name": "MITRE T1046",
    "tactics": [
      "discovery"
    ],
    "sub_technique_of": null,
    "platforms": [
      "Containers"
    ],
    "url": "https://attack.mitre.org/techniques/T1046/"
  },
  "microsoft_k8s_matrix": {
    "id": "MS-TA9031",
    "name": "Network mapping",
    "tactic": "discovery",
    "url": "https://microsoft.github.io/Threat-Matrix-for-Kubernetes/techniques/Network%20mapping/",
    "description": "Attackers may try to map the cluster network to get information on the running applications, including scanning for known vulnerabilities. By default, there is no restriction on pods communication in Kubernetes. Therefore, attackers who gain access to a single container, may use it to probe the network."
  },
  "data_components": [],
  "detection_strategies": [],
  "vendor_detections": [],
  "references": [
    "https://microsoft.github.io/Threat-Matrix-for-Kubernetes/techniques/Network%20mapping/",
    "https://attack.mitre.org/techniques/T1046/"
  ],
  "metadata": {
    "version": "0.1.0",
    "schema_version": "0.1.0",
    "created": "2026-05-04",
    "updated": "2026-05-04",
    "contributors": [
      "equilibrium-bootstrap"
    ]
  }
}
