{
  "id": "EQ-MS-TA9021",
  "title": "Clear container logs",
  "description": "Attackers may delete the application or OS logs on a compromised container in an attempt to prevent detection of their activity.",
  "tags": [
    "kubernetes",
    "stub"
  ],
  "mitre_attack": {
    "technique_id": "T1070",
    "name": "Indicator Removal",
    "tactics": [
      "defense_evasion"
    ],
    "sub_technique_of": null,
    "platforms": [
      "Containers"
    ],
    "url": "https://attack.mitre.org/techniques/T1070/"
  },
  "microsoft_k8s_matrix": {
    "id": "MS-TA9021",
    "name": "Clear container logs",
    "tactic": "defense_evasion",
    "url": "https://microsoft.github.io/Threat-Matrix-for-Kubernetes/techniques/Clear%20container%20logs/",
    "description": "Attackers may delete the application or OS logs on a compromised container in an attempt to prevent detection of their activity."
  },
  "data_components": [],
  "detection_strategies": [],
  "vendor_detections": [],
  "references": [
    "https://microsoft.github.io/Threat-Matrix-for-Kubernetes/techniques/Clear%20container%20logs/",
    "https://attack.mitre.org/techniques/T1070/"
  ],
  "metadata": {
    "version": "0.1.0",
    "schema_version": "0.1.0",
    "created": "2026-05-04",
    "updated": "2026-05-04",
    "contributors": [
      "equilibrium-bootstrap"
    ]
  }
}
