{
  "id": "EQ-MS-TA9036",
  "title": "ARP poisoning and IP spoofing",
  "description": "Kubernetes has numerous network plugins (Container Network Interfaces or CNIs) that can be used in the cluster. Kubenet is the basic, and in many cases the default, network plugin. In this configuration, a bridge is created on each node (cbr0) to which the various pods are connected using veth pairs. The fact that cross-pod traffic is through a bridge, a level-2 component, means that performing ARP poisoning in the cluster is possible. Therefore, if attackers get access to a pod in the cluster, they can perform ARP poisoning, and spoof the traffic of other pods. By using this technique, attackers can perform several attacks at the network-level which can lead to lateral movements, such as DNS spoofing or stealing cloud identities of other pods (CVE-2021-1677).",
  "tags": [
    "kubernetes",
    "stub"
  ],
  "mitre_attack": {
    "technique_id": "T1557",
    "name": "Adversary-in-the-Middle",
    "tactics": [
      "credential_access",
      "collection"
    ],
    "sub_technique_of": null,
    "platforms": [
      "Containers"
    ],
    "url": "https://attack.mitre.org/techniques/T1557/"
  },
  "microsoft_k8s_matrix": {
    "id": "MS-TA9036",
    "name": "ARP poisoning and IP spoofing",
    "tactic": "lateral_movement",
    "url": "https://microsoft.github.io/Threat-Matrix-for-Kubernetes/techniques/ARP%20poisoning%20and%20IP%20spoofing/",
    "description": "Kubernetes has numerous network plugins (Container Network Interfaces or CNIs) that can be used in the cluster. Kubenet is the basic, and in many cases the default, network plugin. In this configuration, a bridge is created on each node (cbr0) to which the various pods are connected using veth pairs. The fact that cross-pod traffic is through a bridge, a level-2 component, means that performing ARP poisoning in the cluster is possible. Therefore, if attackers get access to a pod in the cluster, they can perform ARP poisoning, and spoof the traffic of other pods. By using this technique, attackers can perform several attacks at the network-level which can lead to lateral movements, such as DNS spoofing or stealing cloud identities of other pods (CVE-2021-1677)."
  },
  "data_components": [],
  "detection_strategies": [],
  "vendor_detections": [],
  "references": [
    "https://microsoft.github.io/Threat-Matrix-for-Kubernetes/techniques/ARP%20poisoning%20and%20IP%20spoofing/",
    "https://attack.mitre.org/techniques/T1557/"
  ],
  "metadata": {
    "version": "0.1.0",
    "schema_version": "0.1.0",
    "created": "2026-05-04",
    "updated": "2026-05-04",
    "contributors": [
      "equilibrium-bootstrap"
    ]
  }
}
