{
  "id": "EQ-MS-TA9040",
  "title": "Denial of service",
  "description": "Attackers may attempt to perform a denial of service attack, which makes the service unavailable to the legitimate users. In container clusters, this include attempts to block the availability of the containers themselves, the underlying nodes, or the API server.",
  "tags": [
    "kubernetes",
    "stub"
  ],
  "mitre_attack": {
    "technique_id": "T1498",
    "name": "Network Denial of Service",
    "tactics": [
      "impact"
    ],
    "sub_technique_of": null,
    "platforms": [
      "Containers"
    ],
    "url": "https://attack.mitre.org/techniques/T1498/"
  },
  "microsoft_k8s_matrix": {
    "id": "MS-TA9040",
    "name": "Denial of service",
    "tactic": "impact",
    "url": "https://microsoft.github.io/Threat-Matrix-for-Kubernetes/techniques/Denial%20of%20service/",
    "description": "Attackers may attempt to perform a denial of service attack, which makes the service unavailable to the legitimate users. In container clusters, this include attempts to block the availability of the containers themselves, the underlying nodes, or the API server."
  },
  "data_components": [],
  "detection_strategies": [],
  "vendor_detections": [],
  "references": [
    "https://microsoft.github.io/Threat-Matrix-for-Kubernetes/techniques/Denial%20of%20service/",
    "https://attack.mitre.org/techniques/T1498/",
    "https://attack.mitre.org/techniques/T1499/"
  ],
  "metadata": {
    "version": "0.1.0",
    "schema_version": "0.1.0",
    "created": "2026-05-04",
    "updated": "2026-05-04",
    "contributors": [
      "equilibrium-bootstrap"
    ]
  }
}
