{
  "id": "EQ-MS-TA9015",
  "title": "Malicious admission controller",
  "description": "Admission controller is a Kubernetes component that intercepts, and possibly modifies, requests to the Kubernetes API server. There are two types of admissions controllers: validating and mutating controllers. As the name implies, a mutating admission controller can modify the intercepted request and change its properties. Kubernetes has a built-in generic admission controller named MutatingAdmissionWebhook. The behavior of this admission controller is determined by an admission webhook that the user deploys in the cluster. Attackers can use such webhooks for gaining persistence in the cluster. For example, attackers can intercept and modify the pod creation operations in the cluster and add their malicious container to every created pod.",
  "tags": [
    "kubernetes",
    "stub"
  ],
  "mitre_attack": {
    "technique_id": "T1546",
    "name": "MITRE T1546",
    "tactics": [
      "persistence"
    ],
    "sub_technique_of": null,
    "platforms": [
      "Containers"
    ],
    "url": "https://attack.mitre.org/techniques/T1546/"
  },
  "microsoft_k8s_matrix": {
    "id": "MS-TA9015",
    "name": "Malicious admission controller",
    "tactic": "persistence",
    "url": "https://microsoft.github.io/Threat-Matrix-for-Kubernetes/techniques/Malicious%20admission%20controller/",
    "description": "Admission controller is a Kubernetes component that intercepts, and possibly modifies, requests to the Kubernetes API server. There are two types of admissions controllers: validating and mutating controllers. As the name implies, a mutating admission controller can modify the intercepted request and change its properties. Kubernetes has a built-in generic admission controller named MutatingAdmissionWebhook. The behavior of this admission controller is determined by an admission webhook that the user deploys in the cluster. Attackers can use such webhooks for gaining persistence in the cluster. For example, attackers can intercept and modify the pod creation operations in the cluster and add their malicious container to every created pod."
  },
  "data_components": [],
  "detection_strategies": [],
  "vendor_detections": [],
  "references": [
    "https://microsoft.github.io/Threat-Matrix-for-Kubernetes/techniques/Malicious%20admission%20controller/",
    "https://attack.mitre.org/techniques/T1546/"
  ],
  "metadata": {
    "version": "0.1.0",
    "schema_version": "0.1.0",
    "created": "2026-05-04",
    "updated": "2026-05-04",
    "contributors": [
      "equilibrium-bootstrap"
    ]
  }
}
